{
  "schemaVersion": "1.0",
  "contentVersion": "0.5.0",
  "scientificStatus": "approved",
  "speciesId": "chicken",
  "foodId": "wheat",
  "digestibility": {
    "dryMatter": 57,
    "protein": 86,
    "starch": 93.8,
    "fat": null,
    "energy": 11.1,
    "type": "Valores por variable; consultar método y condiciones",
    "method": "Materia seca: digestibilidad ileal aparente, 57 %. Proteína: media de digestibilidad ileal aparente de aminoácidos, 86 %; no equivale a proteína cruda. Almidón: digestibilidad en íleon posterior, 93.8 %. AMEn: 11.1 MJ/kg de materia seca.",
    "units": "%",
    "energyUnits": "MJ/kg MS"
  },
  "physiologicalResponse": {
    "mainOrganIds": [
      "gizzard",
      "duodenum",
      "jejunum",
      "ileum"
    ],
    "motilityEffects": [
      "Los arabinoxilanos solubles pueden elevar viscosidad y alterar tránsito."
    ],
    "secretions": [
      "Ácido y pepsina en estómago; bilis y enzimas pancreáticas en intestino según el nutriente."
    ],
    "neuroendocrineResponses": [
      "Señales intestinales como CCK coordinan secreción pancreática y biliar tras la llegada de nutrientes."
    ],
    "metabolicNotes": [
      "En ensayos controlados se observaron 57 % de digestibilidad ileal de materia seca, 86 % de media aparente de aminoácidos y 93.8 % de digestibilidad del almidón en íleon posterior.",
      "Tasa ileal de digestión del almidón observada: 0.117 min⁻¹.",
      "Los valores son específicos del método y no deben interpretarse como propiedades constantes de todos los lotes."
    ]
  },
  "studyConditions": {
    "age": "Pollos Ross de 24 a 35 días para materia seca, aminoácidos y AMEn; pollos de engorde para almidón; 28 días para la dinámica del almidón.",
    "geneticLine": "Ross en el ensayo de Perttilä et al.; línea no especificada en los otros ensayos citados.",
    "diet": "Trigo como única fuente proteica en dieta semipurificada para materia seca y aminoácidos; dieta experimental específica para almidón.",
    "processing": "Trigo molido; en Perttilä et al. se molió con rodillos y tamiz de 4 mm y se peletizó en frío. Cultivar, molienda y uso de enzimas modifican el resultado.",
    "method": "Marcador de cromo y colecta de íleon distal para materia seca y aminoácidos; técnica de sacrificio y marcador para almidón; colecta total de excretas y corrección por nitrógeno para AMEn."
  },
  "simulation": {
    "particleColor": "#D6A85F",
    "speedMultiplier": 1,
    "highlightedNutrients": [
      "almidón",
      "proteína",
      "polisacáridos no amiláceos"
    ],
    "stageOverrides": [
      {
        "organId": "gizzard",
        "durationSeconds": 4,
        "message": "Los arabinoxilanos solubles pueden elevar viscosidad y alterar tránsito.",
        "audioFile": "audio/narration/es-GT/chicken/food_wheat_gizzard.mp3"
      },
      {
        "organId": "duodenum",
        "durationSeconds": 5,
        "message": "El trigo libera almidón con rapidez, pero su fracción soluble puede aumentar la viscosidad.",
        "audioFile": "audio/narration/es-GT/chicken/food_wheat_duodenum.mp3"
      },
      {
        "organId": "ileum",
        "durationSeconds": 5,
        "message": "Tasa ileal de digestión del almidón observada: 0.117 min⁻¹.",
        "audioFile": "audio/narration/es-GT/chicken/food_wheat_ileum.mp3"
      }
    ]
  },
  "referenceIds": [
    "perttila_et_al_2005",
    "weurding_et_al_2001",
    "ravindran_et_al_1999",
    "selle_et_al_2021",
    "heuze_et_al_wheat_2015",
    "svihus_2014"
  ]
}
