{
  "schemaVersion": "1.0",
  "contentVersion": "0.3.0",
  "scientificStatus": "pending",
  "speciesId": "chicken",
  "foodId": "sunflower_meal",
  "digestibility": {
    "dryMatter": null,
    "protein": 76.7,
    "starch": null,
    "fat": null,
    "energy": null,
    "type": "Valores por variable; consultar método y condiciones",
    "method": "Digestibilidad ileal aparente media de 15 aminoácidos: 76.7 %; no representa digestibilidad de proteína cruda. AMEn no reportada para el tipo exacto de producto.",
    "units": "%",
    "energyUnits": "MJ/kg MS"
  },
  "physiologicalResponse": {
    "mainOrganIds": [
      "gizzard",
      "duodenum",
      "jejunum",
      "ileum"
    ],
    "motilityEffects": [
      "La fibra y el grado de descascarado condicionan tránsito y utilización."
    ],
    "secretions": [
      "Ácido y pepsina en estómago; bilis y enzimas pancreáticas en intestino según el nutriente."
    ],
    "neuroendocrineResponses": [
      "Señales intestinales como CCK coordinan secreción pancreática y biliar tras la llegada de nutrientes."
    ],
    "metabolicNotes": [
      "Digestibilidad ileal aparente media de 15 aminoácidos: 76.7 % sin fitasa.",
      "Los valores son específicos del método y no deben interpretarse como propiedades constantes de todos los lotes."
    ]
  },
  "studyConditions": {
    "age": "Pollos de engorde de 5 semanas para aminoácidos.",
    "geneticLine": "Pollos de engorde; la línea genética no fue especificada en los resúmenes utilizados.",
    "diet": "Dietas experimentales del ensayo citado o valores compilados de Feedipedia; no representan una dieta comercial completa.",
    "processing": "Harina de girasol de la muestra experimental, sin fitasa; descascarado no informado en el resumen.",
    "method": "Digestibilidad ileal por marcador para aminoácidos o grasa cuando se informa; AMEn corregida por nitrógeno en base materia seca para energía tabulada."
  },
  "simulation": {
    "particleColor": "#5F5144",
    "speedMultiplier": 1,
    "highlightedNutrients": [
      "proteína",
      "fibra",
      "aminoácidos azufrados"
    ],
    "stageOverrides": [
      {
        "organId": "gizzard",
        "durationSeconds": 4,
        "message": "La fibra y el grado de descascarado condicionan tránsito y utilización.",
        "audioFile": "audio/narration/es-GT/chicken/food_sunflower_meal_gizzard.mp3"
      },
      {
        "organId": "duodenum",
        "durationSeconds": 5,
        "message": "La harina de girasol aporta proteína, pero su fibra puede limitar la digestión.",
        "audioFile": "audio/narration/es-GT/chicken/food_sunflower_meal_duodenum.mp3"
      },
      {
        "organId": "ileum",
        "durationSeconds": 5,
        "message": "Digestibilidad ileal aparente media de 15 aminoácidos: 76.7 % sin fitasa.",
        "audioFile": "audio/narration/es-GT/chicken/food_sunflower_meal_ileum.mp3"
      }
    ]
  },
  "referenceIds": [
    "ravindran_et_al_1999",
    "heuze_et_al_sunflower_2019",
    "ravindran_abdollahi_2021"
  ]
}
