{
  "schemaVersion": "1.0",
  "contentVersion": "0.5.0",
  "scientificStatus": "approved",
  "speciesId": "chicken",
  "foodId": "sunflower_meal",
  "digestibility": {
    "dryMatter": null,
    "protein": 76.7,
    "starch": null,
    "fat": null,
    "energy": 7.47,
    "type": "Valores por variable; consultar método y condiciones",
    "method": "Digestibilidad ileal aparente media de 15 aminoácidos: 76.7 %; no representa digestibilidad de proteína cruda. AMEn de harina de girasol descascarada, molida y no prepeletizada: 7.47 MJ/kg de materia seca.",
    "units": "%",
    "energyUnits": "MJ/kg MS"
  },
  "physiologicalResponse": {
    "mainOrganIds": [
      "gizzard",
      "duodenum",
      "jejunum",
      "ileum"
    ],
    "motilityEffects": [
      "La fibra y el grado de descascarado condicionan tránsito y utilización."
    ],
    "secretions": [
      "Ácido y pepsina en estómago; bilis y enzimas pancreáticas en intestino según el nutriente."
    ],
    "neuroendocrineResponses": [
      "Señales intestinales como CCK coordinan secreción pancreática y biliar tras la llegada de nutrientes."
    ],
    "metabolicNotes": [
      "Digestibilidad ileal aparente media de 15 aminoácidos: 76.7 % sin fitasa.",
      "La harina descascarada molida aportó 7.47 MJ de AMEn/kg MS; el mismo lote prepeletizado alcanzó 8.79 MJ/kg MS, por lo que el procesamiento no debe omitirse.",
      "Los valores son específicos del método y no deben interpretarse como propiedades constantes de todos los lotes."
    ]
  },
  "studyConditions": {
    "age": "Pollos de engorde de 5 semanas para aminoácidos; machos Ross 308 de 8 a 21 días para AMEn.",
    "geneticLine": "Pollos de engorde en el ensayo de aminoácidos; Ross 308 en el ensayo de energía.",
    "diet": "Dietas experimentales con harina de girasol; para energía se incluyó 200 g/kg del ingrediente en una dieta de prueba.",
    "processing": "Muestra de aminoácidos sin fitasa. El valor energético corresponde a harina descascarada, extraída con hexano, molida y no prepeletizada.",
    "method": "Marcador ileal para aminoácidos; colecta total de excretas, corrección por nitrógeno y método de sustitución para AMEn."
  },
  "simulation": {
    "particleColor": "#5F5144",
    "speedMultiplier": 1,
    "highlightedNutrients": [
      "proteína",
      "fibra",
      "aminoácidos azufrados"
    ],
    "stageOverrides": [
      {
        "organId": "gizzard",
        "durationSeconds": 4,
        "message": "La fibra y el grado de descascarado condicionan tránsito y utilización.",
        "audioFile": "audio/narration/es-GT/chicken/food_sunflower_meal_gizzard.mp3"
      },
      {
        "organId": "duodenum",
        "durationSeconds": 5,
        "message": "La harina de girasol aporta proteína, pero su fibra puede limitar la digestión.",
        "audioFile": "audio/narration/es-GT/chicken/food_sunflower_meal_duodenum.mp3"
      },
      {
        "organId": "ileum",
        "durationSeconds": 5,
        "message": "Digestibilidad ileal aparente media de 15 aminoácidos: 76.7 % sin fitasa.",
        "audioFile": "audio/narration/es-GT/chicken/food_sunflower_meal_ileum.mp3"
      }
    ]
  },
  "referenceIds": [
    "karkelanov_et_al_2021",
    "ravindran_et_al_1999",
    "heuze_et_al_sunflower_2019",
    "ravindran_abdollahi_2021"
  ]
}
