{
  "schemaVersion": "1.0",
  "contentVersion": "0.5.0",
  "scientificStatus": "approved",
  "speciesId": "chicken",
  "foodId": "sorghum",
  "digestibility": {
    "dryMatter": null,
    "protein": 74.7,
    "starch": 95.4,
    "fat": null,
    "energy": 15.4,
    "type": "Valores por variable; consultar método y condiciones",
    "method": "Proteína: digestibilidad ileal aparente media de 15 aminoácidos, 74.7 %; no representa digestibilidad de proteína cruda. Almidón: digestibilidad en íleon posterior, 95.4 %. AMEn: 15.4 MJ/kg de materia seca, valor tabulado.",
    "units": "%",
    "energyUnits": "MJ/kg MS"
  },
  "physiologicalResponse": {
    "mainOrganIds": [
      "gizzard",
      "duodenum",
      "jejunum",
      "ileum"
    ],
    "motilityEffects": [
      "La matriz proteica y los taninos pueden limitar acceso enzimático según variedad."
    ],
    "secretions": [
      "Ácido y pepsina en estómago; bilis y enzimas pancreáticas en intestino según el nutriente."
    ],
    "neuroendocrineResponses": [
      "Señales intestinales como CCK coordinan secreción pancreática y biliar tras la llegada de nutrientes."
    ],
    "metabolicNotes": [
      "La digestibilidad del almidón en íleon posterior fue 95.4 % en el ensayo seleccionado.",
      "Tasa ileal de digestión del almidón observada: 0.075 min⁻¹.",
      "Los valores son específicos del método y no deben interpretarse como propiedades constantes de todos los lotes."
    ]
  },
  "studyConditions": {
    "age": "Pollos de engorde de 5 semanas para aminoácidos; pollos de engorde para almidón; 28 días para dinámica del almidón; edad variable en AMEn tabulada.",
    "geneticLine": "Pollos de engorde; la línea genética no fue especificada en los resúmenes utilizados.",
    "diet": "Dietas experimentales del ensayo citado o valores compilados de Feedipedia; no representan una dieta comercial completa.",
    "processing": "Sorgo molido sin fitasa; variedad y taninos deben identificarse.",
    "method": "Marcador ileal para aminoácidos; técnica de sacrificio y marcador para almidón; AMEn corregida por nitrógeno en base materia seca para energía tabulada."
  },
  "simulation": {
    "particleColor": "#B96B43",
    "speedMultiplier": 1,
    "highlightedNutrients": [
      "almidón",
      "proteína",
      "taninos"
    ],
    "stageOverrides": [
      {
        "organId": "gizzard",
        "durationSeconds": 4,
        "message": "La matriz proteica y los taninos pueden limitar acceso enzimático según variedad.",
        "audioFile": "audio/narration/es-GT/chicken/food_sorghum_gizzard.mp3"
      },
      {
        "organId": "duodenum",
        "durationSeconds": 5,
        "message": "La digestión del sorgo depende especialmente de la variedad y su contenido de taninos.",
        "audioFile": "audio/narration/es-GT/chicken/food_sorghum_duodenum.mp3"
      },
      {
        "organId": "ileum",
        "durationSeconds": 5,
        "message": "Tasa ileal de digestión del almidón observada: 0.075 min⁻¹.",
        "audioFile": "audio/narration/es-GT/chicken/food_sorghum_ileum.mp3"
      }
    ]
  },
  "referenceIds": [
    "weurding_et_al_2001",
    "ravindran_et_al_1999",
    "selle_et_al_2021",
    "heuze_tran_lebas_sorghum_2015",
    "svihus_2014"
  ]
}
