{
  "schemaVersion": "1.0",
  "contentVersion": "0.3.0",
  "scientificStatus": "pending",
  "speciesId": "chicken",
  "foodId": "barley",
  "digestibility": {
    "dryMatter": null,
    "protein": null,
    "starch": null,
    "fat": null,
    "energy": 11.3,
    "type": "Valores por variable; consultar método y condiciones",
    "method": "No hay un valor de aminoácidos compatible seleccionado; se conserva nulo. AMEn expresada en MJ/kg de materia seca; valor tabulado o, para aceite, guía de ponedoras.",
    "units": "%",
    "energyUnits": "MJ/kg MS"
  },
  "physiologicalResponse": {
    "mainOrganIds": [
      "gizzard",
      "duodenum",
      "jejunum",
      "ileum"
    ],
    "motilityEffects": [
      "Los beta-glucanos pueden aumentar viscosidad; la fibra estructural estimula molleja."
    ],
    "secretions": [
      "Ácido y pepsina en estómago; bilis y enzimas pancreáticas en intestino según el nutriente."
    ],
    "neuroendocrineResponses": [
      "Señales intestinales como CCK coordinan secreción pancreática y biliar tras la llegada de nutrientes."
    ],
    "metabolicNotes": [
      "Tasa ileal de digestión del almidón observada: 0.104 min⁻¹.",
      "Los valores son específicos del método y no deben interpretarse como propiedades constantes de todos los lotes."
    ]
  },
  "studyConditions": {
    "age": "Pollos de engorde de 28 días para dinámica del almidón; edad variable en AMEn tabulada.",
    "geneticLine": "Pollos de engorde; la línea genética no fue especificada en los resúmenes utilizados.",
    "diet": "Dietas experimentales del ensayo citado o valores compilados de Feedipedia; no representan una dieta comercial completa.",
    "processing": "Cebada molida; el descascarado y la beta-glucanasa cambian su valor.",
    "method": "Digestibilidad ileal por marcador para aminoácidos o grasa cuando se informa; AMEn corregida por nitrógeno en base materia seca para energía tabulada."
  },
  "simulation": {
    "particleColor": "#CFAF68",
    "speedMultiplier": 1,
    "highlightedNutrients": [
      "almidón",
      "fibra",
      "beta-glucanos"
    ],
    "stageOverrides": [
      {
        "organId": "gizzard",
        "durationSeconds": 4,
        "message": "Los beta-glucanos pueden aumentar viscosidad; la fibra estructural estimula molleja.",
        "audioFile": "audio/narration/es-GT/chicken/food_barley_gizzard.mp3"
      },
      {
        "organId": "duodenum",
        "durationSeconds": 5,
        "message": "La cebada combina almidón con una fracción fibrosa rica en beta-glucanos.",
        "audioFile": "audio/narration/es-GT/chicken/food_barley_duodenum.mp3"
      },
      {
        "organId": "ileum",
        "durationSeconds": 5,
        "message": "Tasa ileal de digestión del almidón observada: 0.104 min⁻¹.",
        "audioFile": "audio/narration/es-GT/chicken/food_barley_ileum.mp3"
      }
    ]
  },
  "referenceIds": [
    "selle_et_al_2021",
    "heuze_et_al_barley_2016",
    "svihus_2014"
  ]
}
