{
  "schemaVersion": "1.0",
  "contentVersion": "0.5.0",
  "scientificStatus": "approved",
  "speciesId": "chicken",
  "foodId": "corn",
  "digestibility": {
    "dryMatter": 81,
    "protein": 83,
    "starch": 97.4,
    "fat": null,
    "energy": 15.4,
    "type": "Valores por variable; consultar método y condiciones",
    "method": "Materia seca: digestibilidad ileal aparente, 81 %. Proteína: media de digestibilidad ileal aparente de aminoácidos, 83 %; no equivale a proteína cruda. Almidón: digestibilidad en íleon posterior de maíz molido con rodillos, 97.4 %. AMEn: 15.4 MJ/kg de materia seca.",
    "units": "%",
    "energyUnits": "MJ/kg MS"
  },
  "physiologicalResponse": {
    "mainOrganIds": [
      "gizzard",
      "duodenum",
      "jejunum",
      "ileum"
    ],
    "motilityEffects": [
      "El tamaño de partícula modifica el trabajo y retención de la molleja."
    ],
    "secretions": [
      "Ácido y pepsina en estómago; bilis y enzimas pancreáticas en intestino según el nutriente."
    ],
    "neuroendocrineResponses": [
      "Señales intestinales como CCK coordinan secreción pancreática y biliar tras la llegada de nutrientes."
    ],
    "metabolicNotes": [
      "En ensayos controlados se observaron 81 % de digestibilidad ileal de materia seca, 83 % de media aparente de aminoácidos y 97.4 % de digestibilidad del almidón en íleon posterior.",
      "Tasa ileal de digestión del almidón observada: 0.086 min⁻¹.",
      "Los valores son específicos del método y no deben interpretarse como propiedades constantes de todos los lotes."
    ]
  },
  "studyConditions": {
    "age": "Pollos Ross de 24 a 35 días para materia seca, aminoácidos y AMEn; pollos de engorde para almidón; 28 días para la dinámica del almidón.",
    "geneticLine": "Ross en el ensayo de Perttilä et al.; línea no especificada en los otros ensayos citados.",
    "diet": "Maíz como única fuente proteica en dieta semipurificada para materia seca y aminoácidos; dieta experimental específica para almidón.",
    "processing": "Grano molido; el valor de 97.4 % corresponde a maíz molido con rodillos. El tamaño de partícula debe registrarse al aplicar los datos.",
    "method": "Marcador de cromo y colecta de íleon distal para materia seca y aminoácidos; técnica de sacrificio y marcador para almidón; colecta total de excretas y corrección por nitrógeno para AMEn."
  },
  "simulation": {
    "particleColor": "#E9B949",
    "speedMultiplier": 1,
    "highlightedNutrients": [
      "almidón",
      "proteína",
      "lípidos"
    ],
    "stageOverrides": [
      {
        "organId": "gizzard",
        "durationSeconds": 4,
        "message": "El tamaño de partícula modifica el trabajo y retención de la molleja.",
        "audioFile": "audio/narration/es-GT/chicken/food_corn_gizzard.mp3"
      },
      {
        "organId": "duodenum",
        "durationSeconds": 5,
        "message": "El almidón del maíz se digiere progresivamente y aporta glucosa.",
        "audioFile": "audio/narration/es-GT/chicken/food_corn_duodenum.mp3"
      },
      {
        "organId": "ileum",
        "durationSeconds": 5,
        "message": "Tasa ileal de digestión del almidón observada: 0.086 min⁻¹.",
        "audioFile": "audio/narration/es-GT/chicken/food_corn_ileum.mp3"
      }
    ]
  },
  "referenceIds": [
    "perttila_et_al_2005",
    "weurding_et_al_2001",
    "ravindran_et_al_1999",
    "selle_et_al_2021",
    "heuze_tran_lebas_2017",
    "svihus_2014"
  ]
}
