{
  "schemaVersion": "1.0",
  "contentVersion": "0.5.0",
  "scientificStatus": "approved",
  "speciesId": "chicken",
  "foodId": "oats",
  "digestibility": {
    "dryMatter": 58,
    "protein": 79,
    "starch": 99,
    "fat": null,
    "energy": 11.4,
    "type": "Valores por variable; consultar método y condiciones",
    "method": "Materia seca: digestibilidad ileal aparente, 58 %. Proteína: media de digestibilidad ileal aparente de aminoácidos, 79 %; no equivale a proteína cruda. Almidón: digestibilidad ileal de una dieta peletizada basada en avena, 99 %. AMEn: 11.4 MJ/kg de materia seca.",
    "units": "%",
    "energyUnits": "MJ/kg MS"
  },
  "physiologicalResponse": {
    "mainOrganIds": [
      "gizzard",
      "duodenum",
      "jejunum",
      "ileum"
    ],
    "motilityEffects": [
      "La cáscara y fibra aumentan volumen y pueden estimular la molleja."
    ],
    "secretions": [
      "Ácido y pepsina en estómago; bilis y enzimas pancreáticas en intestino según el nutriente."
    ],
    "neuroendocrineResponses": [
      "Señales intestinales como CCK coordinan secreción pancreática y biliar tras la llegada de nutrientes."
    ],
    "metabolicNotes": [
      "En ensayos controlados se observaron 58 % de digestibilidad ileal de materia seca, 79 % de media aparente de aminoácidos y 99 % de digestibilidad ileal del almidón en una dieta basada en avena.",
      "Los valores son específicos del método y no deben interpretarse como propiedades constantes de todos los lotes."
    ]
  },
  "studyConditions": {
    "age": "Pollos Ross de 24 a 35 días para materia seca, aminoácidos y AMEn; pollos de 14 a 24 días para almidón.",
    "geneticLine": "Ross en el ensayo de Perttilä et al.; pollos de engorde machos en Bassi et al.",
    "diet": "Avena como única fuente proteica en dieta semipurificada para materia seca y aminoácidos; dieta peletizada basada en avena para almidón.",
    "processing": "Avena regular con cáscara en Perttilä et al.; dieta peletizada en Bassi et al. No extrapolar a avena desnuda o descascarada.",
    "method": "Marcador de cromo y colecta de íleon distal para materia seca y aminoácidos; marcador inerte y colecta ileal para almidón; colecta total de excretas y corrección por nitrógeno para AMEn."
  },
  "simulation": {
    "particleColor": "#D8BE83",
    "speedMultiplier": 1,
    "highlightedNutrients": [
      "fibra",
      "almidón",
      "lípidos"
    ],
    "stageOverrides": [
      {
        "organId": "gizzard",
        "durationSeconds": 4,
        "message": "La cáscara y fibra aumentan volumen y pueden estimular la molleja.",
        "audioFile": "audio/narration/es-GT/chicken/food_oats_gizzard.mp3"
      },
      {
        "organId": "duodenum",
        "durationSeconds": 5,
        "message": "La avena contiene más fibra y grasa y menos almidón que los cereales principales.",
        "audioFile": "audio/narration/es-GT/chicken/food_oats_duodenum.mp3"
      },
      {
        "organId": "ileum",
        "durationSeconds": 5,
        "message": "En las condiciones citadas, la media aparente de aminoácidos fue 79 % y la digestibilidad ileal del almidón alcanzó 99 %.",
        "audioFile": "audio/narration/es-GT/chicken/food_oats_ileum.mp3"
      }
    ]
  },
  "referenceIds": [
    "perttila_et_al_2005",
    "bassi_et_al_2025",
    "heuze_et_al_oats_2016",
    "svihus_2014"
  ]
}
