{
  "schemaVersion": "1.0",
  "contentVersion": "0.5.0",
  "scientificStatus": "approved",
  "speciesId": "chicken",
  "foodId": "alfalfa_meal",
  "digestibility": {
    "dryMatter": null,
    "protein": null,
    "starch": null,
    "fat": null,
    "energy": 3.8,
    "type": "Valores por variable; consultar método y condiciones",
    "method": "No se localizaron coeficientes ileales comparables para materia seca, aminoácidos, almidón o grasa de la misma presentación; se conservan nulos para evitar extrapolaciones. AMEn tabulada para gallos: 3.8 MJ/kg de materia seca.",
    "units": "%",
    "energyUnits": "MJ/kg MS"
  },
  "physiologicalResponse": {
    "mainOrganIds": [
      "gizzard",
      "duodenum",
      "jejunum",
      "ileum"
    ],
    "motilityEffects": [
      "La fibra aumenta volumen y trabajo mecánico, con baja densidad energética."
    ],
    "secretions": [
      "Ácido y pepsina en estómago; bilis y enzimas pancreáticas en intestino según el nutriente."
    ],
    "neuroendocrineResponses": [
      "Señales intestinales como CCK coordinan secreción pancreática y biliar tras la llegada de nutrientes."
    ],
    "metabolicNotes": [
      "No se seleccionó un coeficiente ileal comparable; AMEn tabulada para gallos: 3.8 MJ/kg MS.",
      "Los valores son específicos del método y no deben interpretarse como propiedades constantes de todos los lotes."
    ]
  },
  "studyConditions": {
    "age": "Edad variable para AMEn tabulada; no se seleccionó un ensayo ileal compatible.",
    "geneticLine": "Pollos de engorde; la línea genética no fue especificada en los resúmenes utilizados.",
    "diet": "Dietas experimentales del ensayo citado o valores compilados de Feedipedia; no representan una dieta comercial completa.",
    "processing": "Alfalfa deshidratada y molida; madurez y temperatura de secado modifican calidad.",
    "method": "Digestibilidad ileal por marcador para aminoácidos o grasa cuando se informa; AMEn corregida por nitrógeno en base materia seca para energía tabulada."
  },
  "simulation": {
    "particleColor": "#6F8F45",
    "speedMultiplier": 1,
    "highlightedNutrients": [
      "fibra",
      "proteína",
      "carotenoides"
    ],
    "stageOverrides": [
      {
        "organId": "gizzard",
        "durationSeconds": 4,
        "message": "La fibra aumenta volumen y trabajo mecánico, con baja densidad energética.",
        "audioFile": "audio/narration/es-GT/chicken/food_alfalfa_meal_gizzard.mp3"
      },
      {
        "organId": "duodenum",
        "durationSeconds": 5,
        "message": "La alfalfa aporta fibra y pigmentos; su inclusión debe ser moderada en aves.",
        "audioFile": "audio/narration/es-GT/chicken/food_alfalfa_meal_duodenum.mp3"
      },
      {
        "organId": "ileum",
        "durationSeconds": 5,
        "message": "No se seleccionó un coeficiente ileal comparable; AMEn tabulada para gallos: 3.8 MJ/kg MS.",
        "audioFile": "audio/narration/es-GT/chicken/food_alfalfa_meal_ileum.mp3"
      }
    ]
  },
  "referenceIds": [
    "heuze_et_al_alfalfa_2016",
    "ravindran_abdollahi_2021"
  ]
}
