{
  "schemaVersion": "1.0",
  "contentVersion": "0.5.0",
  "scientificStatus": "approved",
  "speciesId": "chicken",
  "foodId": "soybean_meal",
  "digestibility": {
    "dryMatter": null,
    "protein": 82.2,
    "starch": null,
    "fat": null,
    "energy": 10.7,
    "type": "Valores por variable; consultar método y condiciones",
    "method": "Digestibilidad ileal aparente media de 15 aminoácidos: 82.2 %; no representa digestibilidad de proteína cruda. AMEn tabulada: 10.7 MJ/kg de materia seca. Materia seca, almidón y grasa permanecen nulos por falta de coeficientes compatibles con esta presentación.",
    "units": "%",
    "energyUnits": "MJ/kg MS"
  },
  "physiologicalResponse": {
    "mainOrganIds": [
      "gizzard",
      "duodenum",
      "jejunum",
      "ileum"
    ],
    "motilityEffects": [
      "Oligosacáridos y procesamiento térmico pueden modificar tránsito y utilización."
    ],
    "secretions": [
      "Ácido y pepsina en estómago; bilis y enzimas pancreáticas en intestino según el nutriente."
    ],
    "neuroendocrineResponses": [
      "Señales intestinales como CCK coordinan secreción pancreática y biliar tras la llegada de nutrientes."
    ],
    "metabolicNotes": [
      "Digestibilidad ileal aparente media de 15 aminoácidos: 82.2 % sin fitasa.",
      "Los valores son específicos del método y no deben interpretarse como propiedades constantes de todos los lotes."
    ]
  },
  "studyConditions": {
    "age": "Pollos de engorde de 5 semanas para aminoácidos; edad variable en AMEn tabulada.",
    "geneticLine": "Pollos de engorde; la línea genética no fue especificada en los resúmenes utilizados.",
    "diet": "Dietas experimentales del ensayo citado o valores compilados de Feedipedia; no representan una dieta comercial completa.",
    "processing": "Harina de soya tostada tipo 48, extraída con solvente; valor sin fitasa.",
    "method": "Digestibilidad ileal por marcador para aminoácidos o grasa cuando se informa; AMEn corregida por nitrógeno en base materia seca para energía tabulada."
  },
  "simulation": {
    "particleColor": "#C5A46D",
    "speedMultiplier": 1,
    "highlightedNutrients": [
      "proteína",
      "aminoácidos",
      "oligosacáridos"
    ],
    "stageOverrides": [
      {
        "organId": "gizzard",
        "durationSeconds": 4,
        "message": "Oligosacáridos y procesamiento térmico pueden modificar tránsito y utilización.",
        "audioFile": "audio/narration/es-GT/chicken/food_soybean_meal_gizzard.mp3"
      },
      {
        "organId": "duodenum",
        "durationSeconds": 5,
        "message": "Las proteasas liberan péptidos y aminoácidos de la harina de soya.",
        "audioFile": "audio/narration/es-GT/chicken/food_soybean_meal_duodenum.mp3"
      },
      {
        "organId": "ileum",
        "durationSeconds": 5,
        "message": "Digestibilidad ileal aparente media de 15 aminoácidos: 82.2 % sin fitasa.",
        "audioFile": "audio/narration/es-GT/chicken/food_soybean_meal_ileum.mp3"
      }
    ]
  },
  "referenceIds": [
    "ravindran_et_al_1999",
    "heuze_tran_kaushik_2020",
    "ravindran_abdollahi_2021"
  ]
}
