{
  "schemaVersion": "1.0",
  "contentVersion": "0.5.0",
  "scientificStatus": "approved",
  "speciesId": "chicken",
  "foodId": "canola_meal",
  "digestibility": {
    "dryMatter": null,
    "protein": 78.7,
    "starch": null,
    "fat": null,
    "energy": 6.8,
    "type": "Valores por variable; consultar método y condiciones",
    "method": "Digestibilidad ileal aparente media de 15 aminoácidos: 78.7 %; no representa digestibilidad de proteína cruda. AMEn tabulada: 6.8 MJ/kg de materia seca. Materia seca, almidón y grasa permanecen nulos por falta de coeficientes compatibles con esta presentación.",
    "units": "%",
    "energyUnits": "MJ/kg MS"
  },
  "physiologicalResponse": {
    "mainOrganIds": [
      "gizzard",
      "duodenum",
      "jejunum",
      "ileum"
    ],
    "motilityEffects": [
      "La mayor fibra puede aumentar retención y reducir densidad energética."
    ],
    "secretions": [
      "Ácido y pepsina en estómago; bilis y enzimas pancreáticas en intestino según el nutriente."
    ],
    "neuroendocrineResponses": [
      "Señales intestinales como CCK coordinan secreción pancreática y biliar tras la llegada de nutrientes."
    ],
    "metabolicNotes": [
      "Digestibilidad ileal aparente media de 15 aminoácidos: 78.7 % sin fitasa.",
      "Los valores son específicos del método y no deben interpretarse como propiedades constantes de todos los lotes."
    ]
  },
  "studyConditions": {
    "age": "Pollos de engorde de 5 semanas para aminoácidos; edad variable en AMEn tabulada.",
    "geneticLine": "Pollos de engorde; la línea genética no fue especificada en los resúmenes utilizados.",
    "diet": "Dietas experimentales del ensayo citado o valores compilados de Feedipedia; no representan una dieta comercial completa.",
    "processing": "Harina 00 extraída con solvente, sin fitasa; no equivale a expeller.",
    "method": "Digestibilidad ileal por marcador para aminoácidos o grasa cuando se informa; AMEn corregida por nitrógeno en base materia seca para energía tabulada."
  },
  "simulation": {
    "particleColor": "#75624A",
    "speedMultiplier": 1,
    "highlightedNutrients": [
      "proteína",
      "fibra",
      "aminoácidos azufrados"
    ],
    "stageOverrides": [
      {
        "organId": "gizzard",
        "durationSeconds": 4,
        "message": "La mayor fibra puede aumentar retención y reducir densidad energética.",
        "audioFile": "audio/narration/es-GT/chicken/food_canola_meal_gizzard.mp3"
      },
      {
        "organId": "duodenum",
        "durationSeconds": 5,
        "message": "La canola aporta proteína, aunque su fibra limita la energía disponible.",
        "audioFile": "audio/narration/es-GT/chicken/food_canola_meal_duodenum.mp3"
      },
      {
        "organId": "ileum",
        "durationSeconds": 5,
        "message": "Digestibilidad ileal aparente media de 15 aminoácidos: 78.7 % sin fitasa.",
        "audioFile": "audio/narration/es-GT/chicken/food_canola_meal_ileum.mp3"
      }
    ]
  },
  "referenceIds": [
    "ravindran_et_al_1999",
    "heuze_et_al_rapeseed_2020",
    "ravindran_abdollahi_2021"
  ]
}
