{
  "schemaVersion": "1.0",
  "contentVersion": "0.5.0",
  "scientificStatus": "approved",
  "speciesId": "chicken",
  "foodId": "soybean_oil",
  "digestibility": {
    "dryMatter": null,
    "protein": null,
    "starch": null,
    "fat": 82,
    "energy": 36.92,
    "type": "Valores por variable; consultar método y condiciones",
    "method": "Digestibilidad aparente de grasa en íleon distal: 82 % en aves jóvenes con aceite añadido a 50 g/kg de dieta. Energía de referencia para aceite de soya: 36.92 MJ/kg. Proteína y almidón no aplican al ingrediente lipídico puro.",
    "units": "%",
    "energyUnits": "MJ/kg MS"
  },
  "physiologicalResponse": {
    "mainOrganIds": [
      "gizzard",
      "duodenum",
      "jejunum",
      "ileum"
    ],
    "motilityEffects": [
      "La grasa insaturada puede enlentecer el tránsito y aumenta la densidad energética."
    ],
    "secretions": [
      "Ácido y pepsina en estómago; bilis y enzimas pancreáticas en intestino según el nutriente."
    ],
    "neuroendocrineResponses": [
      "Señales intestinales como CCK coordinan secreción pancreática y biliar tras la llegada de nutrientes."
    ],
    "metabolicNotes": [
      "Digestibilidad aparente de grasa en íleon distal: 82 %.",
      "Los valores son específicos del método y no deben interpretarse como propiedades constantes de todos los lotes."
    ]
  },
  "studyConditions": {
    "age": "Pollos de engorde de 2 semanas alimentados durante 7 días para digestibilidad ileal de grasa.",
    "geneticLine": "Pollos de engorde; la línea genética no fue especificada en los resúmenes utilizados.",
    "diet": "Dietas experimentales del ensayo citado o valores compilados de Feedipedia; no representan una dieta comercial completa.",
    "processing": "Aceite de soya añadido a 50 g/kg en dieta maíz-soya.",
    "method": "Digestibilidad ileal por marcador para aminoácidos o grasa cuando se informa; AMEn corregida por nitrógeno en base materia seca para energía tabulada."
  },
  "simulation": {
    "particleColor": "#E3C34E",
    "speedMultiplier": 0.9,
    "highlightedNutrients": [
      "lípidos",
      "ácido linoleico",
      "energía"
    ],
    "stageOverrides": [
      {
        "organId": "gizzard",
        "durationSeconds": 4,
        "message": "La grasa insaturada puede enlentecer el tránsito y aumenta la densidad energética.",
        "audioFile": "audio/narration/es-GT/chicken/food_soybean_oil_gizzard.mp3"
      },
      {
        "organId": "duodenum",
        "durationSeconds": 5,
        "message": "La bilis emulsifica el aceite y la lipasa pancreática libera productos absorbibles.",
        "audioFile": "audio/narration/es-GT/chicken/food_soybean_oil_duodenum.mp3"
      },
      {
        "organId": "ileum",
        "durationSeconds": 5,
        "message": "Digestibilidad aparente de grasa en íleon distal: 82 %.",
        "audioFile": "audio/narration/es-GT/chicken/food_soybean_oil_ileum.mp3"
      }
    ]
  },
  "referenceIds": [
    "tancharoenrat_et_al_2014",
    "hyline_brown_2025",
    "ravindran_abdollahi_2021"
  ]
}
