{
  "schemaVersion": "1.0",
  "contentVersion": "0.3.0",
  "scientificStatus": "pending",
  "speciesId": "chicken",
  "foodId": "oats",
  "digestibility": {
    "dryMatter": null,
    "protein": null,
    "starch": null,
    "fat": null,
    "energy": 11.9,
    "type": "Valores por variable; consultar método y condiciones",
    "method": "No hay un valor de aminoácidos compatible seleccionado; se conserva nulo. AMEn expresada en MJ/kg de materia seca; valor tabulado o, para aceite, guía de ponedoras.",
    "units": "%",
    "energyUnits": "MJ/kg MS"
  },
  "physiologicalResponse": {
    "mainOrganIds": [
      "gizzard",
      "duodenum",
      "jejunum",
      "ileum"
    ],
    "motilityEffects": [
      "La cáscara y fibra aumentan volumen y pueden estimular la molleja."
    ],
    "secretions": [
      "Ácido y pepsina en estómago; bilis y enzimas pancreáticas en intestino según el nutriente."
    ],
    "neuroendocrineResponses": [
      "Señales intestinales como CCK coordinan secreción pancreática y biliar tras la llegada de nutrientes."
    ],
    "metabolicNotes": [
      "No se seleccionó un ensayo compatible de digestibilidad ileal de nutrientes.",
      "Los valores son específicos del método y no deben interpretarse como propiedades constantes de todos los lotes."
    ]
  },
  "studyConditions": {
    "age": "Edad variable en las 16 observaciones de AMEn para pollos recopiladas por Feedipedia.",
    "geneticLine": "Pollos de engorde; la línea genética no fue especificada en los resúmenes utilizados.",
    "diet": "Dietas experimentales del ensayo citado o valores compilados de Feedipedia; no representan una dieta comercial completa.",
    "processing": "Avena regular con cáscara; no extrapolar a avena desnuda o descascarada.",
    "method": "Digestibilidad ileal por marcador para aminoácidos o grasa cuando se informa; AMEn corregida por nitrógeno en base materia seca para energía tabulada."
  },
  "simulation": {
    "particleColor": "#D8BE83",
    "speedMultiplier": 1,
    "highlightedNutrients": [
      "fibra",
      "almidón",
      "lípidos"
    ],
    "stageOverrides": [
      {
        "organId": "gizzard",
        "durationSeconds": 4,
        "message": "La cáscara y fibra aumentan volumen y pueden estimular la molleja.",
        "audioFile": "audio/narration/es-GT/chicken/food_oats_gizzard.mp3"
      },
      {
        "organId": "duodenum",
        "durationSeconds": 5,
        "message": "La avena contiene más fibra y grasa y menos almidón que los cereales principales.",
        "audioFile": "audio/narration/es-GT/chicken/food_oats_duodenum.mp3"
      },
      {
        "organId": "ileum",
        "durationSeconds": 5,
        "message": "No se seleccionó un ensayo compatible de digestibilidad ileal de nutrientes.",
        "audioFile": "audio/narration/es-GT/chicken/food_oats_ileum.mp3"
      }
    ]
  },
  "referenceIds": [
    "heuze_et_al_oats_2016",
    "svihus_2014"
  ]
}
